Sheet: Sheet1
A3: م | B3: اسم الصنف | C3: الصنف | D3: سعر البيع | E3: كمية جرد 12 | F3: جرد 6/1 | G3: 2019-01-06T00:00:00.000 | H3: 1900-01-07T00:00:00.000 | I3: 1900-01-08T00:00:00.000 | J3: 2019-01-09T00:00:00.000 | K3: 2019-01-10T00:00:00.000 | L3: 2019-01-11T00:00:00.000 | M3: 2019-01-12T00:00:00.000 | N3: 2019-01-13T00:00:00.000 | O3: اجمالي السعر | P3: الكمية كلها | Q3: المتبقي | R3: تمن البضاعة كلها
A4: 1 | B4: كركاديه رويال | C4: اعشاب | D4: 10 | E4: 7 | F4: =RC[-1] -> 7 | O4: =RC[-11]*RC[-8] -> 0 | P4: =SUM(RC[-9]:RC[-2]) -> 0 | Q4: =RC[-11]-RC[-1] -> 7 | R4: =RC[-14]*RC[-13] -> 70
A5: 2 | B5: نعناع رويال | C5: اعشاب | D5: 10 | E5: 10 | F5: =RC[-1] -> 10 | O5: =RC[-11]*RC[-8] -> 0 | P5: =SUM(RC[-9]:RC[-2]) -> 0 | Q5: =RC[-11]-RC[-1] -> 10 | R5: =RC[-14]*RC[-13] -> 100
A6: 3 | B6: يانسون ازيس | C6: اعشاب | D6: 8.25 | E6: 8 | F6: =RC[-1] -> 8 | O6: =RC[-11]*RC[-8] -> 0 | P6: =SUM(RC[-9]:RC[-2]) -> 0 | Q6: =RC[-11]-RC[-1] -> 8 | R6: =RC[-14]*RC[-13] -> 66
A7: 4 | B7: اوليه كيك 1ج | C7: اوليه | D7: 1 | E7: 160 | F7: 115 | O7: =RC[-11]*RC[-8] -> 0 | P7: =SUM(RC[-9]:RC[-2]) -> 0 | Q7: =RC[-11]-RC[-1] -> 115 | R7: =RC[-14]*RC[-13] -> 160
A8: 5 | B8: مولتو اوليه 1ج كرواسون | C8: اوليه | D8: 1 | E8: 61 | F8: 5 | O8: =RC[-11]*RC[-8] -> 0 | P8: =SUM(RC[-9]:RC[-2]) -> 0 | Q8: =RC[-11]-RC[-1] -> 5 | R8: =RC[-14]*RC[-13] -> 61
A9: 6 | B9: اولبكر فينجر | C9: بسكويت | D9: 2 | E9: 264 | F9: 234 | O9: =RC[-11]*RC[-8] -> 0 | P9: =SUM(RC[-9]:RC[-2]) -> 0 | Q9: =RC[-11]-RC[-1] -> 234 | R9: =RC[-14]*RC[-13] -> 528
A10: 7 | B10: بسكويت بوريو كبير | C10: بسكويت | D10: 2 | E10: 203 | F10: 164 | O10: =RC[-11]*RC[-8] -> 0 | P10: =SUM(RC[-9]:RC[-2]) -> 0 | Q10: =RC[-11]-RC[-1] -> 164 | R10: =RC[-14]*RC[-13] -> 406
A11: 8 | B11: هوهوز كيك | C11: بسكويت | D11: 2 | E11: 60 | F11: 0 | O11: =RC[-11]*RC[-8] -> 0 | P11: =SUM(RC[-9]:RC[-2]) -> 0 | Q11: =RC[-11]-RC[-1] -> 0 | R11: =RC[-14]*RC[-13] -> 120
A12: 9 | B12: بلوبيف بوردون | C12: بلوبيف | D12: 36 | E12: 3 | F12: =RC[-1] -> 3 | O12: =RC[-11]*RC[-8] -> 0 | P12: =SUM(RC[-9]:RC[-2]) -> 0 | Q12: =RC[-11]-RC[-1] -> 3 | R12: =RC[-14]*RC[-13] -> 108
A13: 10 | B13: بن عبد المعبود سادة 250 | C13: بن | D13: 32 | E13: 5 | F13: =RC[-1] -> 5 | O13: =RC[-11]*RC[-8] -> 0 | P13: =SUM(RC[-9]:RC[-2]) -> 0 | Q13: =RC[-11]-RC[-1] -> 5 | R13: =RC[-14]*RC[-13] -> 160
A14: 11 | B14: بن عبد المعبود محوج 250 | C14: بن | D14: 42 | E14: 10 | F14: =RC[-1] -> 10 | O14: =RC[-11]*RC[-8] -> 0 | P14: =SUM(RC[-9]:RC[-2]) -> 0 | Q14: =RC[-11]-RC[-1] -> 10 | R14: =RC[-14]*RC[-13] -> 420
A15: 12 | B15: بن عبد المعبود محوج مخصوص | C15: بن | D15: 16 | E15: 12 | F15: =RC[-1] -> 12 | O15: =RC[-11]*RC[-8] -> 0 | P15: =SUM(RC[-9]:RC[-2]) -> 0 | Q15: =RC[-11]-RC[-1] -> 12 | R15: =RC[-14]*RC[-13] -> 192
A16: 13 | B16: بن عبد المعبود سادة فاتح | C16: بن | D16: 14 | E16: 16 | F16: 14 | O16: =RC[-11]*RC[-8] -> 0 | P16: =SUM(RC[-9]:RC[-2]) -> 0 | Q16: =RC[-11]-RC[-1] -> 14 | R16: =RC[-14]*RC[-13] -> 224
A17: 14 | B17: بيبسي انواع 1لتر | C17: بيبسي | D17: 8 | E17: 93 | F17: 87 | O17: =RC[-11]*RC[-8] -> 0 | P17: =SUM(RC[-9]:RC[-2]) -> 0 | Q17: =RC[-11]-RC[-1] -> 87 | R17: =RC[-14]*RC[-13] -> 744
A18: 15 | B18: بيبسي انواع 400ملي | C18: بيبسي | D18: 5 | E18: 9 | F18: 8 | O18: =RC[-11]*RC[-8] -> 0 | P18: =SUM(RC[-9]:RC[-2]) -> 0 | Q18: =RC[-11]-RC[-1] -> 8 | R18: =RC[-14]*RC[-13] -> 45
A19: 16 | B19: شويبس 1 لتر | C19: بيبسي | D19: 11 | E19: 125 | F19: 120 | O19: =RC[-11]*RC[-8] -> 0 | P19: =SUM(RC[-9]:RC[-2]) -> 0 | Q19: =RC[-11]-RC[-1] -> 120 | R19: =RC[-14]*RC[-13] -> 1375
A20: 17 | B20: شويبس زجاج | C20: بيبسي | D20: 6 | E20: 442 | F20: 424 | O20: =RC[-11]*RC[-8] -> 0 | P20: =SUM(RC[-9]:RC[-2]) -> 0 | Q20: =RC[-11]-RC[-1] -> 424 | R20: =RC[-14]*RC[-13] -> 2652
A21: 18 | B21: بيبسي استار انواع مختلفه | C21: بيبسي | D21: 6 | E21: 252 | F21: 248 | O21: =RC[-11]*RC[-8] -> 0 | P21: =SUM(RC[-9]:RC[-2]) -> 0 | Q21: =RC[-11]-RC[-1] -> 248 | R21: =RC[-14]*RC[-13] -> 1512
A22: 19 | B22: بيكنج بودر | C22: بيكينج بودر | D22: 1 | E22: 285 | F22: =RC[-1] -> 285 | O22: =RC[-11]*RC[-8] -> 0 | P22: =SUM(RC[-9]:RC[-2]) -> 0 | Q22: =RC[-11]-RC[-1] -> 285 | R22: =RC[-14]*RC[-13] -> 285
A23: 20 | B23: تانج اطعمه اظرف | C23: تانج | D23: 3 | E23: 117 | F23: =RC[-1] -> 117 | O23: =RC[-11]*RC[-8] -> 0 | P23: =SUM(RC[-9]:RC[-2]) -> 0 | Q23: =RC[-11]-RC[-1] -> 117 | R23: =RC[-14]*RC[-13] -> 351
A24: 21 | B24: تونة صن شاين | C24: تونة | D24: 14 | E24: 37 | F24: 36 | O24: =RC[-11]*RC[-8] -> 0 | P24: =SUM(RC[-9]:RC[-2]) -> 0 | Q24: =RC[-11]-RC[-1] -> 36 | R24: =RC[-14]*RC[-13] -> 518
A25: 22 | B25: تونه امريكانا قطع | C25: تونه | D25: 17.50 | E25: 14 | F25: =RC[-1] -> 14 | O25: =RC[-11]*RC[-8] -> 0 | P25: =SUM(RC[-9]:RC[-2]) -> 0 | Q25: =RC[-11]-RC[-1] -> 14 | R25: =RC[-14]*RC[-13] -> 245
A26: 23 | B26: تونه ماريو قطع | C26: تونه | D26: 18.75 | E26: 23 | F26: =RC[-1] -> 23 | O26: =RC[-11]*RC[-8] -> 0 | P26: =SUM(RC[-9]:RC[-2]) -> 0 | Q26: =RC[-11]-RC[-1] -> 23 | R26: =RC[-14]*RC[-13] -> 431.25
A27: 24 | B27: تونه ماريو مفتته | C27: تونه | D27: 12 | E27: 1 | F27: 0 | O27: =RC[-11]*RC[-8] -> 0 | P27: =SUM(RC[-9]:RC[-2]) -> 0 | Q27: =RC[-11]-RC[-1] -> 0 | R27: =RC[-14]*RC[-13] -> 12
A28: 25 | B28: جبنة دومتى نصف كيلو | C28: جبنة | D28: 14 | E28: 16 | F28: =RC[-1] -> 16 | O28: =RC[-11]*RC[-8] -> 0 | P28: =SUM(RC[-9]:RC[-2]) -> 0 | Q28: =RC[-11]-RC[-1] -> 16 | R28: =RC[-14]*RC[-13] -> 224
A29: 26 | B29: جبنة دومتى ربع كيلو | C29: جبنة دومتى | D29: 7 | E29: 8 | F29: =RC[-1] -> 8 | O29: =RC[-11]*RC[-8] -> 0 | P29: =SUM(RC[-9]:RC[-2]) -> 0 | Q29: =RC[-11]-RC[-1] -> 8 | R29: =RC[-14]*RC[-13] -> 56
A30: 27 | B30: دومتى فيتا كيلو | C30: جبنة دومتى | D30: 25 | E30: 26 | F30: 26 | O30: =RC[-11]*RC[-8] -> 0 | P30: =SUM(RC[-9]:RC[-2]) -> 0 | Q30: =RC[-11]-RC[-1] -> 26 | R30: =RC[-14]*RC[-13] -> 650
A31: 29 | B31: جبنة طعمة مثلثات | C31: جبنه | D31: 7.25 | E31: 0 | F31: =RC[-1] -> 0 | O31: =RC[-11]*RC[-8] -> 0 | P31: =SUM(RC[-9]:RC[-2]) -> 0 | Q31: =RC[-11]-RC[-1] -> 0 | R31: =RC[-14]*RC[-13] -> 0
A32: 30 | B32: جبنه عبور لاند ربع كيلو | C32: جبنه | D32: 7 | E32: 33 | F32: =RC[-1] -> 33 | O32: =RC[-11]*RC[-8] -> 0 | P32: =SUM(RC[-9]:RC[-2]) -> 0 | Q32: =RC[-11]-RC[-1] -> 33 | R32: =RC[-14]*RC[-13] -> 231
A33: 32 | B33: دومتى اكيلو بلص | C33: جبنه | D33: 26 | E33: 26 | F33: =RC[-1] -> 26 | O33: =RC[-11]*RC[-8] -> 0 | P33: =SUM(RC[-9]:RC[-2]) -> 0 | Q33: =RC[-11]-RC[-1] -> 26 | R33: =RC[-14]*RC[-13] -> 676
A34: 33 | B34: عبور لاند نص كيلو | C34: جبنه | D34: 14 | E34: 15 | F34: =RC[-1] -> 15 | O34: =RC[-11]*RC[-8] -> 0 | P34: =SUM(RC[-9]:RC[-2]) -> 0 | Q34: =RC[-11]-RC[-1] -> 15 | R34: =RC[-14]*RC[-13] -> 210
A35: 34 | B35: جل هيركود اكياس | C35: جل | D35: 2 | E35: 100 | F35: =RC[-1] -> 100 | O35: =RC[-11]*RC[-8] -> 0 | P35: =SUM(RC[-9]:RC[-2]) -> 0 | Q35: =RC[-11]-RC[-1] -> 100 | R35: =RC[-14]*RC[-13] -> 200
A36: 35 | B36: جيلي | C36: جيلي | D36: 4.50 | E36: 119 | F36: 117 | O36: =RC[-11]*RC[-8] -> 0 | P36: =SUM(RC[-9]:RC[-2]) -> 0 | Q36: =RC[-11]-RC[-1] -> 117 | R36: =RC[-14]*RC[-13] -> 535.50
A37: 36 | B37: حلاوة سبريد شيكولاته | C37: حلاوة | D37: 23 | E37: 3 | F37: =RC[-1] -> 3 | O37: =RC[-11]*RC[-8] -> 0 | P37: =SUM(RC[-9]:RC[-2]) -> 0 | Q37: =RC[-11]-RC[-1] -> 3 | R37: =RC[-14]*RC[-13] -> 69
A38: 37 | B38: زيت سندباد | C38: زيت | D38: 20 | E38: 3 | F38: 2 | O38: =RC[-11]*RC[-8] -> 0 | P38: =SUM(RC[-9]:RC[-2]) -> 0 | Q38: =RC[-11]-RC[-1] -> 2 | R38: =RC[-14]*RC[-13] -> 60
A39: 38 | B39: زيت عافيه ذرة | C39: زيت | D39: 29 | E39: 5 | F39: =RC[-1] -> 5 | O39: =RC[-11]*RC[-8] -> 0 | P39: =SUM(RC[-9]:RC[-2]) -> 0 | Q39: =RC[-11]-RC[-1] -> 5 | R39: =RC[-14]*RC[-13] -> 145
A40: 39 | B40: زيت عافيه عباد | C40: زيت | D40: 25 | E40: 4 | F40: =RC[-1] -> 4 | O40: =RC[-11]*RC[-8] -> 0 | P40: =SUM(RC[-9]:RC[-2]) -> 0 | Q40: =RC[-11]-RC[-1] -> 4 | R40: =RC[-14]*RC[-13] -> 100
A41: 40 | B41: زيت كريستال عباد | C41: زيت | D41: 25 | E41: 6 | F41: =RC[-1] -> 6 | O41: =RC[-11]*RC[-8] -> 0 | P41: =SUM(RC[-9]:RC[-2]) -> 0 | Q41: =RC[-11]-RC[-1] -> 6 | R41: =RC[-14]*RC[-13] -> 150
A42: 41 | B42: سحلب | C42: سحلب | D42: 8.50 | E42: 7 | F42: 4 | O42: =RC[-11]*RC[-8] -> 0 | P42: =SUM(RC[-9]:RC[-2]) -> 0 | Q42: =RC[-11]-RC[-1] -> 4 | R42: =RC[-14]*RC[-13] -> 59.50
A43: 42 | B43: سمنة روابي اكياس | C43: سمنة | D43: 2.50 | E43: 29 | F43: =RC[-1] -> 29 | O43: =RC[-11]*RC[-8] -> 0 | P43: =SUM(RC[-9]:RC[-2]) -> 0 | Q43: =RC[-11]-RC[-1] -> 29 | R43: =RC[-14]*RC[-13] -> 72.50
A44: 43 | B44: سمنه جنه ا كيلو | C44: سمنه | D44: 22 | E44: 1 | F44: =RC[-1] -> 1 | O44: =RC[-11]*RC[-8] -> 0 | P44: =SUM(RC[-9]:RC[-2]) -> 0 | Q44: =RC[-11]-RC[-1] -> 1 | R44: =RC[-14]*RC[-13] -> 22
A45: 44 | B45: سمنه روابي 1 كيلو | C45: سمنه | D45: 22 | E45: 3 | F45: =RC[-1] -> 3 | O45: =RC[-11]*RC[-8] -> 0 | P45: =SUM(RC[-9]:RC[-2]) -> 0 | Q45: =RC[-11]-RC[-1] -> 3 | R45: =RC[-14]*RC[-13] -> 66
A46: 45 | B46: سمنه كريستال 1 كيلو | C46: سمنه | D46: 26 | E46: 8 | F46: 7 | O46: =RC[-11]*RC[-8] -> 0 | P46: =SUM(RC[-9]:RC[-2]) -> 0 | Q46: =RC[-11]-RC[-1] -> 7 | R46: =RC[-14]*RC[-13] -> 208
A47: 46 | B47: شاي العروسه 40 جرام | C47: شاي | D47: 4 | E47: 265 | F47: 260 | O47: =RC[-11]*RC[-8] -> 0 | P47: =SUM(RC[-9]:RC[-2]) -> 0 | Q47: =RC[-11]-RC[-1] -> 260 | R47: =RC[-14]*RC[-13] -> 1060
A48: 47 | B48: شاي العروسه ربع كيلو | C48: شاي | D48: 21 | E48: 49 | F48: =RC[-1] -> 49 | O48: =RC[-11]*RC[-8] -> 0 | P48: =SUM(RC[-9]:RC[-2]) -> 0 | Q48: =RC[-11]-RC[-1] -> 49 | R48: =RC[-14]*RC[-13] -> 1029
A49: 48 | B49: شاي ليبتون 250 جرام | C49: شاي | D49: 27 | E49: 36 | F49: =RC[-1] -> 36 | O49: =RC[-11]*RC[-8] -> 0 | P49: =SUM(RC[-9]:RC[-2]) -> 0 | Q49: =RC[-11]-RC[-1] -> 36 | R49: =RC[-14]*RC[-13] -> 972
A50: 49 | B50: شاي ليبتون 40جرام | C50: شاي | D50: 5.50 | E50: 182 | F50: 177 | O50: =RC[-11]*RC[-8] -> 0 | P50: =SUM(RC[-9]:RC[-2]) -> 0 | Q50: =RC[-11]-RC[-1] -> 177 | R50: =RC[-14]*RC[-13] -> 1001
A51: 50 | B51: شاي ليبنون 25 فتله | C51: شاي | D51: 11.50 | E51: 90 | F51: 89 | O51: =RC[-11]*RC[-8] -> 0 | P51: =SUM(RC[-9]:RC[-2]) -> 0 | Q51: =RC[-11]-RC[-1] -> 89 | R51: =RC[-14]*RC[-13] -> 1035
A52: 51 | B52: شنط | C52: شنط | E52: 3 | F52: =RC[-1] -> 3 | O52: =RC[-11]*RC[-8] -> 0 | P52: =SUM(RC[-9]:RC[-2]) -> 0 | Q52: =RC[-11]-RC[-1] -> 3 | R52: =RC[-14]*RC[-13] -> 0
A53: 52 | B53: شيكولاتة فاستر | C53: شيكولاتة | D53: 3.25 | E53: 82 | F53: 80 | O53: =RC[-11]*RC[-8] -> 0 | P53: =SUM(RC[-9]:RC[-2]) -> 0 | Q53: =RC[-11]-RC[-1] -> 80 | R53: =RC[-14]*RC[-13] -> 266.50
A54: 53 | B54: شيكولاته جيرسي | C54: شيكولاته | D54: 2.50 | E54: 41 | F54: 29 | O54: =RC[-11]*RC[-8] -> 0 | P54: =SUM(RC[-9]:RC[-2]) -> 0 | Q54: =RC[-11]-RC[-1] -> 29 | R54: =RC[-14]*RC[-13] -> 102.50
A55: 54 | B55: شيكولاته كابرى اوريو | C55: شيكولاته | D55: 12.50 | E55: 12 | F55: 10 | O55: =RC[-11]*RC[-8] -> 0 | P55: =SUM(RC[-9]:RC[-2]) -> 0 | Q55: =RC[-11]-RC[-1] -> 10 | R55: =RC[-14]*RC[-13] -> 150
A56: 55 | B56: شيكولاته كابرى بندق صغير | C56: شيكولاته | D56: 2.50 | E56: 25 | F56: 12 | O56: =RC[-11]*RC[-8] -> 0 | P56: =SUM(RC[-9]:RC[-2]) -> 0 | Q56: =RC[-11]-RC[-1] -> 12 | R56: =RC[-14]*RC[-13] -> 62.50
A57: 56 | B57: شيكولاته كابرى بندق كبير | C57: شيكولاته | D57: 15 | E57: 6 | F57: 5 | O57: =RC[-11]*RC[-8] -> 0 | P57: =SUM(RC[-9]:RC[-2]) -> 0 | Q57: =RC[-11]-RC[-1] -> 5 | R57: =RC[-14]*RC[-13] -> 90
A58: 57 | B58: شيكولاته كابرى مارفيلس | C58: شيكولاته | D58: 12.50 | E58: 18 | F58: =RC[-1] -> 18 | O58: =RC[-11]*RC[-8] -> 0 | P58: =SUM(RC[-9]:RC[-2]) -> 0 | Q58: =RC[-11]-RC[-1] -> 18 | R58: =RC[-14]*RC[-13] -> 225
A59: 58 | B59: شيكولاته مورو صغيرة | C59: شيكولاته | D59: 3.25 | E59: 13 | F59: 10 | O59: =RC[-11]*RC[-8] -> 0 | P59: =SUM(RC[-9]:RC[-2]) -> 0 | Q59: =RC[-11]-RC[-1] -> 10 | R59: =RC[-14]*RC[-13] -> 42.25
A60: 59 | B60: بريل صابون سائل اكياس | C60: صابون | D60: 1.50 | E60: 19 | F60: =RC[-1] -> 19 | O60: =RC[-11]*RC[-8] -> 0 | P60: =SUM(RC[-9]:RC[-2]) -> 0 | Q60: =RC[-11]-RC[-1] -> 19 | R60: =RC[-14]*RC[-13] -> 28.50
A61: 60 | B61: صابون جوى | C61: صابون | D61: 6 | E61: 16 | F61: 15 | O61: =RC[-11]*RC[-8] -> 0 | P61: =SUM(RC[-9]:RC[-2]) -> 0 | Q61: =RC[-11]-RC[-1] -> 15 | R61: =RC[-14]*RC[-13] -> 96
A62: 61 | B62: صابون كامي صغير | C62: صابون | D62: 7 | E62: 11 | F62: 10 | O62: =RC[-11]*RC[-8] -> 0 | P62: =SUM(RC[-9]:RC[-2]) -> 0 | Q62: =RC[-11]-RC[-1] -> 10 | R62: =RC[-14]*RC[-13] -> 77
A63: 63 | B63: طحينة البوادي ص | C63: طحينة | D63: 11 | E63: 2 | F63: =RC[-1] -> 2 | O63: =RC[-11]*RC[-8] -> 0 | P63: =SUM(RC[-9]:RC[-2]) -> 0 | Q63: =RC[-11]-RC[-1] -> 2 | R63: =RC[-14]*RC[-13] -> 22
A64: 64 | B64: طحينة ظرف | C64: طحينة | D64: 2.25 | E64: 96 | F64: =RC[-1] -> 96 | O64: =RC[-11]*RC[-8] -> 0 | P64: =SUM(RC[-9]:RC[-2]) -> 0 | Q64: =RC[-11]-RC[-1] -> 96 | R64: =RC[-14]*RC[-13] -> 216
A65: 65 | B65: عسل اسود التمساح | C65: عسل | D65: 10.15 | E65: 9 | F65: 7 | O65: =RC[-11]*RC[-8] -> 0 | P65: =SUM(RC[-9]:RC[-2]) -> 0 | Q65: =RC[-11]-RC[-1] -> 7 | R65: =RC[-14]*RC[-13] -> 91.35
A66: 66 | B66: عسل ابيض الملكه 250 جرام | C66: عسل ابيض | D66: 15 | E66: 4 | F66: =RC[-1] -> 4 | O66: =RC[-11]*RC[-8] -> 0 | P66: =SUM(RC[-9]:RC[-2]) -> 0 | Q66: =RC[-11]-RC[-1] -> 4 | R66: =RC[-14]*RC[-13] -> 60
A67: 67 | B67: عسل ابيض الملكه 500 جرام | C67: عسل ابيض | D67: 30 | E67: 9 | F67: =RC[-1] -> 9 | O67: =RC[-11]*RC[-8] -> 0 | P67: =SUM(RC[-9]:RC[-2]) -> 0 | Q67: =RC[-11]-RC[-1] -> 9 | R67: =RC[-14]*RC[-13] -> 270
A68: 68 | B68: فانليا كوكس | C68: فانليا | D68: 0.50 | E68: 863 | F68: =RC[-1] -> 863 | O68: =RC[-11]*RC[-8] -> 0 | P68: =SUM(RC[-9]:RC[-2]) -> 0 | Q68: =RC[-11]-RC[-1] -> 863 | R68: =RC[-14]*RC[-13] -> 431.50
A69: 69 | B69: فول هارفست | C69: فول علب | D69: 6.75 | E69: 4 | F69: 2 | O69: =RC[-11]*RC[-8] -> 0 | P69: =SUM(RC[-9]:RC[-2]) -> 0 | Q69: =RC[-11]-RC[-1] -> 2 | R69: =RC[-14]*RC[-13] -> 27
A70: 70 | B70: فيجيتار حار | C70: فيجيتار | D70: 2 | E70: 252 | F70: =RC[-1] -> 252 | O70: =RC[-11]*RC[-8] -> 0 | P70: =SUM(RC[-9]:RC[-2]) -> 0 | Q70: =RC[-11]-RC[-1] -> 252 | R70: =RC[-14]*RC[-13] -> 504
A71: 71 | B71: بنجور نسكافيه كابتشينو | C71: كابتشينو | D71: 3 | E71: 15 | F71: 14 | O71: =RC[-11]*RC[-8] -> 0 | P71: =SUM(RC[-9]:RC[-2]) -> 0 | Q71: =RC[-11]-RC[-1] -> 14 | R71: =RC[-14]*RC[-13] -> 45
A72: 72 | B72: كاتشب ظرف | C72: كاتشب | D72: 0.35 | E72: 2388 | F72: 2384 | O72: =RC[-11]*RC[-8] -> 0 | P72: =SUM(RC[-9]:RC[-2]) -> 0 | Q72: =RC[-11]-RC[-1] -> 2384 | R72: =RC[-14]*RC[-13] -> 835.80
A73: 73 | B73: كاتشب هاينز بارد | C73: كاتشب | D73: 10 | E73: 13 | F73: =RC[-1] -> 13 | O73: =RC[-11]*RC[-8] -> 0 | P73: =SUM(RC[-9]:RC[-2]) -> 0 | Q73: =RC[-11]-RC[-1] -> 13 | R73: =RC[-14]*RC[-13] -> 130
A74: 74 | B74: كبريت | C74: كبريت | D74: 0.50 | E74: 162 | F74: 157 | O74: =RC[-11]*RC[-8] -> 0 | P74: =SUM(RC[-9]:RC[-2]) -> 0 | Q74: =RC[-11]-RC[-1] -> 157 | R74: =RC[-14]*RC[-13] -> 81
A75: 75 | B75: اسكتش رسم | C75: كشكول | D75: 11 | E75: 20 | F75: =RC[-1] -> 20 | O75: =RC[-11]*RC[-8] -> 0 | P75: =SUM(RC[-9]:RC[-2]) -> 0 | Q75: =RC[-11]-RC[-1] -> 20 | R75: =RC[-14]*RC[-13] -> 220
A76: 76 | B76: اقلام انواع | C76: كشكول | D76: 2.50 | E76: 64 | F76: 62 | O76: =RC[-11]*RC[-8] -> 0 | P76: =SUM(RC[-9]:RC[-2]) -> 0 | Q76: =RC[-11]-RC[-1] -> 62 | R76: =RC[-14]*RC[-13] -> 160
A77: 77 | B77: كراسة 28 ورقة | C77: كشكول | D77: 3 | E77: 109 | F77: =RC[-1] -> 109 | O77: =RC[-11]*RC[-8] -> 0 | P77: =SUM(RC[-9]:RC[-2]) -> 0 | Q77: =RC[-11]-RC[-1] -> 109 | R77: =RC[-14]*RC[-13] -> 327
A78: 78 | B78: كشكول40 ورقة | C78: كشكول | D78: 4 | E78: 27 | F78: =RC[-1] -> 27 | O78: =RC[-11]*RC[-8] -> 0 | P78: =SUM(RC[-9]:RC[-2]) -> 0 | Q78: =RC[-11]-RC[-1] -> 27 | R78: =RC[-14]*RC[-13] -> 108
A79: 79 | B79: كشكول60 ورقة | C79: كشكول | D79: 6 | E79: 49 | F79: =RC[-1] -> 49 | O79: =RC[-11]*RC[-8] -> 0 | P79: =SUM(RC[-9]:RC[-2]) -> 0 | Q79: =RC[-11]-RC[-1] -> 49 | R79: =RC[-14]*RC[-13] -> 294
B80: تشيكلز صغير 0.5 | C80: لبان | D80: 0.50 | E80: 696 | F80: 677 | O80: =RC[-11]*RC[-8] -> 0 | P80: =SUM(RC[-9]:RC[-2]) -> 0 | R80: =RC[-14]*RC[-13] -> 348
A81: 80 | B81: تشيكلز انواع باكو 4.25 | C81: لبان | D81: 4.25 | E81: 75 | F81: =RC[-1] -> 75 | O81: =RC[-11]*RC[-8] -> 0 | P81: =SUM(RC[-9]:RC[-2]) -> 0 | Q81: =RC[-11]-RC[-1] -> 75 | R81: =RC[-14]*RC[-13] -> 318.75
A82: 81 | B82: لبان ترايدنت صغير 0.5 | C82: لبان | D82: 0.50 | E82: 233 | F82: 207 | O82: =RC[-11]*RC[-8] -> 0 | P82: =SUM(RC[-9]:RC[-2]) -> 0 | Q82: =RC[-11]-RC[-1] -> 207 | R82: =RC[-14]*RC[-13] -> 116.50
A83: 82 | B83: لبان سمارة قلب 0.35 | C83: لبان | D83: 0.35 | E83: 465 | F83: 457 | O83: =RC[-11]*RC[-8] -> 0 | P83: =SUM(RC[-9]:RC[-2]) -> 0 | Q83: =RC[-11]-RC[-1] -> 457 | R83: =RC[-14]*RC[-13] -> 162.75
A84: 83 | B84: لبان كلورتس باكو 5.00 | C84: لبان | D84: 5 | E84: 21 | F84: =RC[-1] -> 21 | O84: =RC[-11]*RC[-8] -> 0 | P84: =SUM(RC[-9]:RC[-2]) -> 0 | Q84: =RC[-11]-RC[-1] -> 21 | R84: =RC[-14]*RC[-13] -> 105
A85: 84 | B85: لبان كلورتس صغير 0.5 | C85: لبان | D85: 0.50 | E85: 725 | F85: 710 | O85: =RC[-11]*RC[-8] -> 0 | P85: =SUM(RC[-9]:RC[-2]) -> 0 | Q85: =RC[-11]-RC[-1] -> 710 | R85: =RC[-14]*RC[-13] -> 362.50
A86: 85 | B86: برطمان مايونيز هاينز | C86: مايونيز | D86: 20 | E86: 1 | F86: =RC[-1] -> 1 | O86: =RC[-11]*RC[-8] -> 0 | P86: =SUM(RC[-9]:RC[-2]) -> 0 | Q86: =RC[-11]-RC[-1] -> 1 | R86: =RC[-14]*RC[-13] -> 20
A87: 86 | B87: مايونيز ظرف | C87: مايونيز | D87: 0.45 | E87: 1776 | F87: =RC[-1] -> 1776 | O87: =RC[-11]*RC[-8] -> 0 | P87: =SUM(RC[-9]:RC[-2]) -> 0 | Q87: =RC[-11]-RC[-1] -> 1776 | R87: =RC[-14]*RC[-13] -> 799.20
A88: 87 | B88: مربي الرشيدي صغير اطعمه | C88: مربي | D88: 14 | E88: 19 | F88: =RC[-1] -> 19 | O88: =RC[-11]*RC[-8] -> 0 | P88: =SUM(RC[-9]:RC[-2]) -> 0 | Q88: =RC[-11]-RC[-1] -> 19 | R88: =RC[-14]*RC[-13] -> 266
A89: 88 | B89: مربي فرجلو اطعمه | C89: مربي | D89: 24 | E89: 10 | F89: =RC[-1] -> 10 | O89: =RC[-11]*RC[-8] -> 0 | P89: =SUM(RC[-9]:RC[-2]) -> 0 | Q89: =RC[-11]-RC[-1] -> 10 | R89: =RC[-14]*RC[-13] -> 240
A90: 89 | B90: مربي فرجلو اطعمه صغير | C90: مربي | D90: 10 | E90: 24 | F90: =RC[-1] -> 24 | O90: =RC[-11]*RC[-8] -> 0 | P90: =SUM(RC[-9]:RC[-2]) -> 0 | Q90: =RC[-11]-RC[-1] -> 24 | R90: =RC[-14]*RC[-13] -> 240
A91: 90 | B91: مربي فيتراك 500 جرام صغير | C91: مربي | D91: 15 | E91: 6 | F91: =RC[-1] -> 6 | O91: =RC[-11]*RC[-8] -> 0 | P91: =SUM(RC[-9]:RC[-2]) -> 0 | Q91: =RC[-11]-RC[-1] -> 6 | R91: =RC[-14]*RC[-13] -> 90
A92: 91 | B92: مربي فيتراك اطعمه كبير | C92: مربي | D92: 28 | E92: 12 | F92: =RC[-1] -> 12 | O92: =RC[-11]*RC[-8] -> 0 | P92: =SUM(RC[-9]:RC[-2]) -> 0 | Q92: =RC[-11]-RC[-1] -> 12 | R92: =RC[-14]*RC[-13] -> 336
A93: 92 | B93: مصاصه اللوان | C93: مصاصه | D93: 1 | E93: 9 | F93: 4 | O93: =RC[-11]*RC[-8] -> 0 | P93: =SUM(RC[-9]:RC[-2]) -> 0 | Q93: =RC[-11]-RC[-1] -> 4 | R93: =RC[-14]*RC[-13] -> 9
A94: 93 | B94: معجون اسنان سيجنال | C94: معجون اسنان | D94: 5.50 | E94: 8 | F94: =RC[-1] -> 8 | O94: =RC[-11]*RC[-8] -> 0 | P94: =SUM(RC[-9]:RC[-2]) -> 0 | Q94: =RC[-11]-RC[-1] -> 8 | R94: =RC[-14]*RC[-13] -> 44
A95: 94 | B95: معطر ملابس داوني | C95: معطر | D95: 39 | E95: 11 | F95: =RC[-1] -> 11 | O95: =RC[-11]*RC[-8] -> 0 | P95: =SUM(RC[-9]:RC[-2]) -> 0 | Q95: =RC[-11]-RC[-1] -> 11 | R95: =RC[-14]*RC[-13] -> 429
A96: 95 | B96: مكرونه المكله انواع | C96: مكرونه | D96: 4.25 | E96: 27 | F96: =RC[-1] -> 27 | O96: =RC[-11]*RC[-8] -> 0 | P96: =SUM(RC[-9]:RC[-2]) -> 0 | Q96: =RC[-11]-RC[-1] -> 27 | R96: =RC[-14]*RC[-13] -> 114.75
A97: 96 | B97: مكرونه حواء انواع | C97: مكرونه | D97: 4.25 | E97: 19 | F97: =RC[-1] -> 19 | O97: =RC[-11]*RC[-8] -> 0 | P97: =SUM(RC[-9]:RC[-2]) -> 0 | Q97: =RC[-11]-RC[-1] -> 19 | R97: =RC[-14]*RC[-13] -> 80.75
A98: 97 | B98: مكينه حلاقة جيليت | C98: مكينه حلاقه | D98: 7.50 | E98: 24 | F98: =RC[-1] -> 24 | O98: =RC[-11]*RC[-8] -> 0 | P98: =SUM(RC[-9]:RC[-2]) -> 0 | Q98: =RC[-11]-RC[-1] -> 24 | R98: =RC[-14]*RC[-13] -> 180
A99: 98 | B99: ملح طعام بونو | C99: ملح | D99: 1.25 | E99: 62 | F99: =RC[-1] -> 62 | O99: =RC[-11]*RC[-8] -> 0 | P99: =SUM(RC[-9]:RC[-2]) -> 0 | Q99: =RC[-11]-RC[-1] -> 62 | R99: =RC[-14]*RC[-13] -> 77.50
A100: 99 | B100: مناديل مزيكا | C100: مناديل | D100: 11 | E100: 4 | F100: =RC[-1] -> 4 | O100: =RC[-11]*RC[-8] -> 0 | P100: =SUM(RC[-9]:RC[-2]) -> 0 | Q100: =RC[-11]-RC[-1] -> 4 | R100: =RC[-14]*RC[-13] -> 44
A101: 100 | B101: مناديل مطبخ | C101: مناديل | D101: 11 | E101: 2 | F101: =RC[-1] -> 2 | O101: =RC[-11]*RC[-8] -> 0 | P101: =SUM(RC[-9]:RC[-2]) -> 0 | Q101: =RC[-11]-RC[-1] -> 2 | R101: =RC[-14]*RC[-13] -> 22
A102: 101 | B102: مناديل حمام | C102: مناديل جيب | D102: 4 | E102: 6 | F102: =RC[-1] -> 6 | O102: =RC[-11]*RC[-8] -> 0 | P102: =SUM(RC[-9]:RC[-2]) -> 0 | Q102: =RC[-11]-RC[-1] -> 6 | R102: =RC[-14]*RC[-13] -> 24
A103: 102 | B103: كلور زجاج | C103: منظف | D103: 7.50 | E103: 4 | F103: =RC[-1] -> 4 | O103: =RC[-11]*RC[-8] -> 0 | P103: =SUM(RC[-9]:RC[-2]) -> 0 | Q103: =RC[-11]-RC[-1] -> 4 | R103: =RC[-14]*RC[-13] -> 30
A104: 103 | B104: مياه معدنيه 1.5 لتر | C104: مياه معدنيه | D104: 5 | E104: 39 | F104: 60 | O104: =RC[-11]*RC[-8] -> 0 | P104: =SUM(RC[-9]:RC[-2]) -> 0 | Q104: =RC[-11]-RC[-1] -> 60 | R104: =RC[-14]*RC[-13] -> 195
A105: 104 | B105: كوفي ميكس خمسينه | C105: نسكافيه | D105: 1 | E105: 39 | F105: 35 | O105: =RC[-11]*RC[-8] -> 0 | P105: =SUM(RC[-9]:RC[-2]) -> 0 | Q105: =RC[-11]-RC[-1] -> 35 | R105: =RC[-14]*RC[-13] -> 39
A106: 105 | B106: نسكافيه 3×1 | C106: نسكافيه | D106: 2 | E106: 15 | F106: 11 | O106: =RC[-11]*RC[-8] -> 0 | P106: =SUM(RC[-9]:RC[-2]) -> 0 | Q106: =RC[-11]-RC[-1] -> 11 | R106: =RC[-14]*RC[-13] -> 30
A107: 106 | B107: نسكافيه بلاك اظرف | C107: نسكافيه | D107: 1 | E107: 55 | F107: =RC[-1] -> 55 | O107: =RC[-11]*RC[-8] -> 0 | P107: =SUM(RC[-9]:RC[-2]) -> 0 | Q107: =RC[-11]-RC[-1] -> 55 | R107: =RC[-14]*RC[-13] -> 55
A108: 107 | B108: نسكافيه كوفى ميكس | C108: نسكافيه | D108: 2 | E108: 47 | F108: 43 | O108: =RC[-11]*RC[-8] -> 0 | P108: =SUM(RC[-9]:RC[-2]) -> 0 | Q108: =RC[-11]-RC[-1] -> 43 | R108: =RC[-14]*RC[-13] -> 94
A109: 108 | B109: نسكافيه برطمان عرض | C109: نسكافيه | D109: 33 | E109: 9 | F109: =RC[-1] -> 9 | O109: =RC[-11]*RC[-8] -> 0 | P109: =SUM(RC[-9]:RC[-2]) -> 0 | Q109: =RC[-11]-RC[-1] -> 9 | R109: =RC[-14]*RC[-13] -> 297
A110: 109 | B110: نسكويك ظرف | C110: نسكويك | D110: 1.50 | E110: 96 | F110: 84 | O110: =RC[-11]*RC[-8] -> 0 | P110: =SUM(RC[-9]:RC[-2]) -> 0 | Q110: =RC[-11]-RC[-1] -> 84 | R110: =RC[-14]*RC[-13] -> 144
A111: 110 | B111: نسكويك مسحوق شيكولاته | C111: نسكويك | D111: 17.50 | E111: 11 | F111: =RC[-1] -> 11 | O111: =RC[-11]*RC[-8] -> 0 | P111: =SUM(RC[-9]:RC[-2]) -> 0 | Q111: =RC[-11]-RC[-1] -> 11 | R111: =RC[-14]*RC[-13] -> 192.50
A112: 111 | B112: نشا كوكس | C112: نشا | D112: 4.75 | E112: 45 | F112: =RC[-1] -> 45 | O112: =RC[-11]*RC[-8] -> 0 | P112: =SUM(RC[-9]:RC[-2]) -> 0 | Q112: =RC[-11]-RC[-1] -> 45 | R112: =RC[-14]*RC[-13] -> 213.75
A113: 112 | B113: لبن نيدو اساسي اكياس | C113: نيدو | D113: 3.25 | E113: 11 | F113: =RC[-1] -> 11 | O113: =RC[-11]*RC[-8] -> 0 | P113: =SUM(RC[-9]:RC[-2]) -> 0 | Q113: =RC[-11]-RC[-1] -> 11 | R113: =RC[-14]*RC[-13] -> 35.75
A114: 113 | B114: لبن نيدو مقوى اكياس | C114: نيدو | D114: 4.50 | E114: 2 | F114: =RC[-1] -> 2 | O114: =RC[-11]*RC[-8] -> 0 | P114: =SUM(RC[-9]:RC[-2]) -> 0 | Q114: =RC[-11]-RC[-1] -> 2 | R114: =RC[-14]*RC[-13] -> 9
A115: 114 | B115: نيدو 100 جرام | C115: نيدو | D115: 15 | E115: 5 | F115: =RC[-1] -> 5 | O115: 0 | P115: =SUM(RC[-9]:RC[-2]) -> 0 | Q115: =RC[-11]-RC[-1] -> 5 | R115: =RC[-14]*RC[-13] -> 75
A116: 115 | B116: نيدو 300 جرام | C116: نيدو | D116: 46 | E116: 10 | F116: =RC[-1] -> 10 | O116: 0 | P116: =SUM(RC[-9]:RC[-2]) -> 0 | Q116: =RC[-11]-RC[-1] -> 10 | R116: =RC[-14]*RC[-13] -> 460
A117: 116 | B117: اندومي اطعمه | D117: 3 | E117: 30 | F117: 11 | O117: =RC[-11]*RC[-8] -> 0 | P117: =SUM(RC[-9]:RC[-2]) -> 0 | Q117: =RC[-11]-RC[-1] -> 11 | R117: =RC[-14]*RC[-13] -> 90
G118: =COUNT(R[-114]C:R[-1]C) -> 0 | H118: =COUNT(R[-114]C:R[-1]C) -> 0 | I118: =COUNT(R[-114]C:R[-1]C) -> 0 | J118: =COUNT(R[-114]C:R[-1]C) -> 0 | K118: =COUNT(R[-114]C:R[-1]C) -> 0 | L118: =COUNT(R[-114]C:R[-1]C) -> 0 | M118: =COUNT(R[-114]C:R[-1]C) -> 0 | N118: =COUNT(R[-114]C:R[-1]C) -> 0 | O118: =SUM(R[-114]C:R[-1]C) -> 0 | P118: =SUM(RC[-9]:RC[-1]) -> 0 | R118: =SUM(R[-114]C:R[-1]C) -> 30969.35